ID_Claim_Resumo;Processo_ID;Sentenca_Claim;Prediction_LLM;Confianca_LLM;Justificativa_LLM;Contexto_Utilizado_LLM
7;733-2025;O Acórdão 733/2025 trata do pedido do TCU para que o BNDES seja transformado em autarquia, a fim de alinhar sua estrutura ao controle da União.;Incorreto;1.0000;Os parágrafos não mencionam a transformação do BNDES em autarquia. O Acórdão discute aspectos relacionados à remuneração de empregados, como o teto constitucional (§9º do art. 37 da CF), adequação de planos de cargos e salários, e questionamentos sobre a classificação do BNDES como empresa estatal dependente. A proposta de reclassificação como autarquia não é tratada nos trechos fornecidos, que focam em regulamentações salariais e conformidade legal, não em mudanças estruturais de natureza institucional.;"Análise: para além do resumo feito pelo BNDES, em suas considerações analíticas (peça 215, p. 
14-17), a instituição bem recordou que a norma que serviu de fundamento para a determinação 
emanada dos pronunciamentos da subunidade (peça 169, p. 28) e da unidade (peça 170, p. 6), qual 
seja: inciso III do art. 1º, da Resolução CCE 9/1996 foi revogada pela Resolução CGPAR nº 42, de 
04.08.2022 (peça 225). Para concluir: ‘Assim, é esta última hoje a responsável por estabelecer 
diretrizes e parâmetros para empresas estatais federais em matéria de adequação de Regulamentos 
Internos de Pessoal e Planos de Cargos e Salários’ (peça 215, p. 16). 
De fato, há de se reconhecer a errônea fundamentação da proposta de determinação dos 
pronunciamentos precedentes. Em consulta ao texto da norma vigente, extrai-se a determinação 
fulcrada nesse novo normativo:  
‘Art. 4º Nas propostas de novos Planos de Cargos e Salários, deverão as empresas estatais 
federais excluir anuênios, autorizando, se for o caso, quinquênios, cujo valor máximo 
será de 1% (cinco por cento) do salário base do empregado, limitado ao teto de dez 
quinquênios.’ (sem grifos, no original) 
Em que pese a alegação da manifestação do BNDES acerca da autorização do Secretário Executivo 
do Ministério do Planejamento, em sede do Ofício nº 926/2005/MP/SE (peça 189): ‘...instituições 
integrantes do Sistema BNDES, fiquem dispensadas do cumprimento da disposição prevista no 
inciso III, do art. 1º da Resolução CCE nº 09/96’, vê-se que a dispensa ocorreu até 5/8/2022, data 
em que ocorreu a publicação da Resolução CGPAR nº 42/2022 e que foi revogada a Resolução 
CCE nº 09/1996. 
Portanto, a proposta de determinação deverá se transformar em: 
‘Exclua, nos novos Plano de Cargos e Salários, os anuênios, autorizando, se for o caso, 
quinquênios, cujo valor máximo será de 1% (cinco por cento) do salário base do 
empregado, limitado ao teto de dez quinquênios, nos termos do disposto no art. 4º da 
Resolução CGPAR nº 42/2022, sendo vedada, com base no art. 7º, inciso VI, da 
Constituição da República, a redução dos valores recebidos pelos empregados que já 
percebam montante superior a 10 % do salário base, os quais deverão deixar, entretanto, de 
ter qualquer incremento financeiro nessa rubrica, seja a que título for, até que seus 
vencimentos básicos sejam elevados o suficiente para observar aquele percentual máximo 
definido pela legislação;’ 
iii)  Incorporação à remuneração de gratificação de cargo em comissão ou de função 
gratificada: ‘o BNDES atende à citada proposta de encaminhamento, uma vez que não permite a 
cumulação entre gratificação ou comissão incorporada com aquela a que se faça jus no exercício de 
nova função assumida após a incorporação. Não obstante, tem-se que a proposta de 
encaminhamento relativa à incorporação de gratificação merece reanálise e reconsideração, uma 
vez que a medida em questão foi precedida de autorização do Secretário Executivo do Ministério 
do Planejamento, Desenvolvimento e Gestão, além de representar cumprimento de decisão judicial’ 
– peça 215, p. 7; 
Análise: O BNDES por meio de sua manifestação nos autos afirma que ‘já atende à citada proposta 
de encaminhamento, uma vez que não permite a cumulação entre gratificação ou comissão 
incorporada com aquela a que se faça jus no exercício de nova função assumida após a 
incorporação’ (peça 215, p. 18). Fundamenta sua afirmação em normas presentes na CF; na CLT; 
em súmulas do TST; em outros textos legais; em decretos do poder executivo; em normas interna 
da instituição; em um quadro com diversas ações trabalhistas movida em face de si, tanto por 
associação de empregados, quanto por meio de ações individuais. 
Considerando que o BNDES afirma já estar atendendo o quanto disposto na determinação proposta 
nos pronunciamentos anteriores, vê-se que sua reiteração não lhe trará nenhum prejuízo, portanto 
essa deve se manter nos termos propostos, alterando-se, mutatis mutandis, a legislação que a 
fundamenta. 
iv)  Modificação da sistemática de vale-transporte: ‘a proposta de encaminhamento merece 
reanálise e reconsideração, uma vez que o benefício em questão foi aprovado pela Secretaria de 
Para verificar as assinaturas, acesse www.tcu.gov.br/autenticidade e informe o código 77445700. [SEP_CONTEXTO] Trata-se de representação oferecida pelo Ministério Público junto ao TCU, de autoria do 
Procurador Marinus Eduardo de Vries Marsico, a fim de que esta Corte avalie a incidência do disposto 
no § 9º do art. 37 da Constituição Federal, que trata do teto remuneratório sobre os empregados 
públicos do Banco Nacional de Desenvolvimento Econômico e Social (BNDES) (peça 1).  
2. Ao longo da instrução processual, foram acrescentados ao debate outros aspectos relativos 
à estrutura salarial do funcionalismo do BNDES, incluindo a indicação de verbas que seriam 
consideradas pecuniariamente excessivas ou possivelmente irregulares. 
3. Após o saneamento dos autos via inspeção e realização de oitiva ao BNDES, autorizada 
pelo então relator Ministro Vital do Rêgo (peça 81), a unidade instrutora apresentou posições 
divergentes, como descrito a seguir. 
4. O auditor responsável pela análise (peça 168) concluiu à época que não seria necessário 
alterar a classificação do BNDES de empresa pública para autarquia ou classificá-la como dependente 
para limitar os salários de seus empregados ao teto constitucional, sendo suficiente para tanto a 
constatação de que o funding utilizado pelo BNDES é majoritariamente de fontes públicas, assim 
como de empréstimos efetuados pelo Tesouro mediante emissão direta de títulos públicos.  
5. O diretor da unidade concordou parcialmente com o auditor, divergindo quanto à 
necessidade de reclassificar o BNDES como estatal dependente. Essa definição seria primordial para 
submeter o banco ao teto remuneratório constitucional e consequentemente proibir a distribuição de 
participação nos lucros e resultados (peça 169). 
6. O auditor-chefe da unidade discordou de ambos (peça 170), por considerar que o acesso a 
funding público é inerente à condição de banco de desenvolvimento, sendo necessariamente 
remunerado por isso. Registra que o valor dispendido para o pagamento das despesas com pessoal viria 
do resultado da intermediação financeira e retira a proposta de firmar o entendimento de que o BNDES 
seja considerado como empresa estatal dependente. Em sequência, complementa os encaminhamentos 
relacionados à não aprovação do plano de cargos e salários pela Secretaria de Coordenação e 
Governança das Empresas Estatais (Sest) e ao pagamento irregular de determinadas gratificações. 
7. Em razão das considerações feitas nessa fase, foi concedido novo prazo para que o banco 
se manifestasse a respeito das consequências práticas da implementação das medidas aventadas e 
eventuais alternativas. 
8. Após novo pronunciamento do BNDES, o auditor retornou à conclusão de que o banco 
estaria sujeito à incidência do teto constitucional previsto no inciso XI. c/c o § 9º do art. 37 da CF, uma 
vez que seu funding seria majoritariamente proveniente dos recursos públicos e daí sairiam os recursos 
para o pagamento de despesas de pessoal ou de custeio em geral (peça 232, p. 18). 
9. Em síntese, a instrução argumenta que a LRF pode ser interpretada de forma a criar uma 
nova classe de estatal submetida ao teto constitucional. Essa categoria incluiria empresas cujo funding 
fosse composto por recursos provenientes da União, independentemente da rubrica, como no caso do 
BNDES. Mesmo que essas estatais obtivessem lucro, ainda assim estariam submetidas ao teto 
remuneratório, pois, de maneira indireta, utilizariam esse ganho para custear suas despesas, tendo 
como origem os recursos recebidos do Tesouro.  
10. Desta feita, a instrução do auditor teve anuência do corpo diretivo da unidade (peças 233 e 
234), sendo a proposta final da unidade instrutora:  
Para verificar as assinaturas, acesse www.tcu.gov.br/autenticidade e informe o código 77445706. [SEP_CONTEXTO] quaisquer operações financeiras em que sejam utilizados recursos do funding do banco, 
explicitando os impactos financeiros presentes e futuros aos cofres públicos da União, com base no 
Pronunciamento Técnico CPC 05 (R1) – Divulgação sobre Partes Relacionadas, conforme 
preconiza o Plano Contábil das Instituições do Sistema Financeiro Nacional (Cosif), de observância 
obrigatória pelo banco, segundo a Resolução CMN 4.858/2020 e a Resolução BCB 92/2021, em 
que se exige que as transações com partes relacionadas sejam devidamente registradas nas 
demonstrações contábeis de instituições financeiras, como é o caso do relacionamento existente 
entre BNDES e União Federal; e 
b.11) encaminhe ao Tribunal, no prazo de 45 dias, as medidas adotadas para o cumprimento das 
determinações proferidas nos subitens b.1 a b.10 acima; 
c) determinar à Secretaria de Coordenação e Governança das Empresas Estatais – SEST, com 
fundamento no art. 250, inciso II, do Regimento Interno do Tribunal de Contas da União, que: 
c.1) adote, em prazo compatível com os respectivos itens, as medidas necessárias para que o Banco 
Nacional de Desenvolvimento Econômico e Social dê cumprimento às medidas preconizadas nos 
itens b.1 a b.10 desta proposta de encaminhamento; 
c.2) manifeste-se, no prazo de trinta dias, sobre o plano de cargos e salários do Banco Nacional de 
Desenvolvimento Econômico e Social, o PECS, conforme preconizado no art. 98, inciso VI, alínea 
‘g’, item 4, do Decreto 9.745/2019, de modo que se possa aferir se aquele plano atende aos 
dispositivos que regem a política de remuneração do Poder Executivo com relação às empresas 
estatais, adotando as providências pertinentes para as adequações que se façam necessárias, 
inclusive aquelas necessárias à correção das irregularidades apuradas nestes autos, e submetendo o 
aludido plano à aprovação do Ministro de Estado do Planejamento, Desenvolvimento e Gestão, ou 
do seu sucessor, nos termos do art. 1º, inciso III, do Decreto 3.735/2001; 
c.3) adote as medidas necessárias para adequar, em trinta dias, todas as verbas remuneratórias, bem 
como todas as outras benesses de caráter não remuneratório, concedidas pelo Banco Nacional de 
Desenvolvimento Econômico e Social ao arrepio ou em condições muito mais favoráveis às 
definidas na Convenção Coletiva de Trabalho da categoria dos bancários, por intermédio de 
Acordos Coletivos de Trabalho não submetidos previamente ao DEST/SEST e não aprovados 
previamente em sede ministerial, nos termos do art. 1º, inciso IV, do Decreto 3.735/2001, firmados 
pelo banco no passado com abuso de direito, os quais seriam, portanto, ilícitos, nos termos do art. 
187 do Código Civil, ressalvando-se os vencimentos básicos dos empregados, que seriam 
irredutíveis, nos termos do art. 7º, inciso VI, da Constituição da República; 
c.4) proceda, doravante, à manifestação prévia de todos os Acordos Coletivos de Trabalho firmados 
pelo Banco Nacional de Desenvolvimento Econômico e Social, nos termos do art. 98, inciso VI, 
alínea ‘g’, item 2, do Decreto 9.745/2019, submetendo seu posicionamento, após essa análise, via 
Ministério supervisor, à aprovação prévia do Ministro de Estado de Planejamento, 
Desenvolvimento e Gestão, ou do seu sucessor, nos termos do art. 1º, inciso IV, do Decreto 
3.735/2001, devendo, ainda, assegurar que a execução efetiva das cláusulas do aludido acordo 
apenas ocorra após a finalização de todo esse trâmite de análise e aprovação pela autoridade 
competente; 
c.5) encaminhe ao Tribunal, no prazo de 45 dias, as medidas adotadas para o cumprimento das 
determinações proferidas nos subitens c.1 a c.4 acima; 
d) recomendar, nos termos do art. 250, inciso III, do Regimento Interno do Tribunal de Contas da 
União, ao Conselho de Administração do Banco Nacional de Desenvolvimento Econômico e 
Social, com fundamento no art. 11 da Resolução–TCU 315/2020, que promova as discussões 
necessárias para aprimorar os normativos do BNDES de modo que não haja a possibilidade de 
ocorrer a nomeação de pessoas para cargos de livre provimento com o recebimento de salários 
incompatíveis com os recebidos por empregados do banco que exercem as mesmas funções, tendo 
em vista sua responsabilidade pela condução das ações relativas à política de gestão de pessoas, 
conforme disposto no art. 36, inciso X, do Estatuto Social do banco; 
Para verificar as assinaturas, acesse www.tcu.gov.br/autenticidade e informe o código 77445700. [SEP_CONTEXTO] 52. Importante consignar que durante o curso processual, o BNDES demonstrou que adotou 
medidas para corrigir impropriedades em determinadas práticas remuneratórias apontadas ainda na 
etapa de instrução processual.  
53. Como empresa estatal federal, ressalto que se aplicam ao banco, no que diz respeito a 
obrigações civis e trabalhistas, o regime jurídico das empresas privadas, nos termos do art. 173, § 1º, 
inciso II, da Constituição Federal.  
54. De forma que, dentro de sua autonomia gerencial e poder discricionário, o BNDES pode 
desenvolver suas políticas de pessoal e fazer acordos trabalhistas, inclusive em âmbito judicial, com a 
avaliação dos seus impactos econômicos, financeiros e operacionais.  
55. Além disso, é importante registrar que, entre o pronunciamento da unidade instrutora e o 
presente julgamento, o BNDES iniciou a elaboração do Novo Plano de Cargos e Salários (NPCS), 
após avaliação para mitigação de riscos judiciais e administrativos, que passará a vigorar para todas as 
novas contratações decorrentes do concurso público realizado em 2024.  
56. Com a elaboração do NPCS, os planos anteriores – Plano Estratégico de Cargos e Salários 
(PECS) e Plano Uniforme de Cargos e Salários (PUCS) – ficarão fechados para novos contratos de 
trabalho, de modo que os cargos ocupados serão extintos à medida que vagarem.   
Participação nos Lucros e Resultados (PLR) e Remuneração Variável Anual (RVA) 
57. Em consequência do entendimento já registrado neste voto quanto à não classificação de 
dependência da empresa estatal, não se sustenta a proposta de determinação da unidade instrutora para 
que o BNDES se abstenha de pagar valores referentes à Participação nos Lucros ou Resultados (PLR) 
a seus empregados e de Remuneração Variável Anual (RVA) a seus dirigentes. 
58. Dessa maneira, discordo da proposta da unidade instrutora para determinar ao BNDES que 
se abstenha de pagá-las. 
59. Resta pendente de análise a proposta de encaminhamento feita pela unidade (peça 170, p. 
6) para que o BNDES: 
“(...) considere, doravante, para fins de cômputo do lucro da estatal a ser objeto de distribuição aos 
empregados e administradores via Participação nos Lucros ou Resultados (PLR) ou Remuneração 
Variável Anual (RVA), respectivamente, tão-somente metas e retornos financeiros vinculados 
estritamente aos objetivos institucionais do banco estatal, não devendo ser computados 
quaisquer ganhos que não visem direta e especificamente às finalidades públicas para as 
quais o banco de fomento foi criado, sob pena de gerar um incentivo pernicioso de perseguir 
investimentos mais lucrativos em operações de tesouraria, o que poderia prejudicar a alocação de 
recursos do banco em investimentos de menor rentabilidade, mas aderentes ao interesse público, 
nos termos do art. 3º do Estatuto Social do BNDES;” (grifei) 
60. Em resposta (peça 215, p. 6), o banco informou que já atende à referida proposta, uma vez 
que, desde o Acordo PLR 2017 e o Acordo de RVA de 2020, as metas de PLR e de RVA não incluem 
lucro líquido, que contemplava o resultado de tesouraria.  
61. Informou, ainda, que, desde o exercício de 2019, o valor total de PLR a ser distribuído aos 
empregados está limitado ao percentual de 4,08% do Lucro Líquido Ajustado (que corresponde ao 
lucro líquido do exercício deduzido do resultado auferido com a eventual diferença entre as taxas de 
juros de captação e de aplicação junto à União, descontados dos efeitos tributários de PIS/COFINS, IR 
e CSSL). No Acordo PLR 2024, esse limite foi reduzido para 3,10% (peça 254, p. 6). 
62. A unidade instrutora questionou o fundamento desse limite e sua aplicabilidade ao RVA. 
Observo que esses limites estão dentro da discricionariedade do banco, devendo estar alinhados ao 
plano de negócios e às cartas anuais previstas na Lei das Estatais (13.303/2016). No caso específico do 
RVA, o programa para 2024 determina que o valor total a ser distribuído não poderá ultrapassar a 
Para verificar as assinaturas, acesse www.tcu.gov.br/autenticidade e informe o código 77445706. [SEP_CONTEXTO] 20.1 Dar ciência à Secretaria de Coordenação e Governança das Empresas Estatais – SEST, com 
fundamento no disposto no inciso II do art. 2º c/c o disposto nos art. 9º e 10 da Resolução TCU 
315/2020, acerca: 
a) das determinações expedidas para o Banco Nacional de Desenvolvimento Econômico e Social 
em sede deste processo; 
b) de a SEST encontrar-se em mora sobre a manifestação prevista no número ‘4’ da alínea ‘g’ do 
inciso VI do art. 36, do Decreto 11.437, de 17 de março de 2023, de modo a aferir se o plano 
atende aos dispositivos que regem a política de remuneração do Poder Executivo com relação às 
empresas estatais, adotando as providências pertinentes para as adequações que se façam 
necessárias, inclusive aquelas necessárias à correção das irregularidades apuradas neste processo, e 
submetendo o aludido plano à aprovação do Ministro de Estado da Gestão e da Inovação em 
Serviços Públicos, ou do seu sucessor, nos termos do disposto no inciso III do art. 1º, do Decreto 
3.735/2001; 
c) da existência de verbas remuneratórias, bem como todas as outras benesses de caráter não 
remuneratório, concedidas pelo BNDES ao arrepio ou em condições muito mais favoráveis às 
definidas na Convenção Coletiva de Trabalho da categoria dos bancários, por intermédio de 
Acordos Coletivos de Trabalho não submetidos previamente à SEST e não aprovados previamente 
em sede ministerial, nos termos do art. 1º, inciso IV, do Decreto 3.735/2001; 
d) da sua competência em sede de Acordos Coletivos de Trabalho firmados pelo BNDES, nos 
termos do disposto no número ‘4’ da alínea ‘g’  do inciso VI do art. 36, do Decreto 11.437, de 17 
de março de 2023, submetendo seu posicionamento, após essa análise, via Ministério supervisor, à 
aprovação prévia do Ministro de Estado de Planejamento, Desenvolvimento e Gestão, ou do seu 
sucessor, nos termos do art. 1º, inciso IV, do Decreto 3.735/2001, devendo, ainda, assegurar que a 
execução efetiva das cláusulas do aludido acordo apenas ocorra após a finalização de todo esse 
trâmite de análise e aprovação pelas autoridades competentes. 
21. A proposta de recomendação aventada ao Conselho de Administração do BNDES (peça 168, p. 
123; peça 169, p. 30-31; peça 170, p. 8) foi originada de dois Relatos de Irregularidades feitas junto 
à Ouvidoria do TCU (peça 168, p. 118). 
22. O empregado relatado já foi desligado da instituição, conforme se verifica no documento 
constante à peça 230. 
23. Entretanto, a última instrução nestes autos elencou a existência de um total de 17 empregados 
como assessores externos (peça 168, p. 120). 
24. Essa mesma instrução consignou que a ‘tabela encaminhada que mesmo dentro da mesma 
função há uma diferença entre as remunerações atribuídas aos nomeados, que recebem 
remunerações muito acima dos valores atribuídos para as funções comissionadas correlatas’ (peça 
168, p. 121). 
25. Concluindo: O ideal seria que fosse normatizada a remuneração de cada cargo de livre de 
nomeação, pois isso daria mais transparência para as situações de livre nomeação e evitaria ilações 
sobre a adequabilidade ou não da remuneração atribuída a um colaborador não pertencente ao 
quadro (peça 168, p. 121). 
26. Vê-se que dos 17 assessores elencados na predita instrução, hoje 16 deles foram desligados, 
permanecendo apenas o Sr. Sandro de Azambuja (justamente o que recebe o menor salário entre 
eles, em torno de 1/3 do salário dos demais), e, foram admitidos outros 18 assessores (com 
elevados salários) a partir de janeiro de 2023 (Relação dos Assessores Externos, peça 231). 
27. Considerando que a proposta de recomendação ao Conselho de Administração do BNDES 
possui a natureza jurídica do instituto da ‘ciência’, previsto no inciso II do art. 2º da Resolução 
TCU 315/2020, propõe-se alterar a redação para as seguintes formas: 
27.1 Dar ciência ao Conselho de Administração do BNDES, com fundamento no disposto no inciso 
II do art. 2º c/c o disposto nos art. 9º e 10 da Resolução TCU 315/2020, e em função de suas 
Para verificar as assinaturas, acesse www.tcu.gov.br/autenticidade e informe o código 77445700."
