ID_Claim_Resumo;Processo_ID;Sentenca_Claim;Prediction_LLM;Confianca_LLM;Justificativa_LLM;Contexto_Utilizado_LLM
3;733-2025;O acórdão também determinou que o banco restituísse os valores recebidos a título de PLR nos últimos cinco anos por violar os limites legais de remuneração.;Incorreto;1.0000;Os parágrafos não mencionam a determinação de restituição dos valores de PLR recebidos nos últimos cinco anos. Pelo contrário, no Parágrafo 5 (itens 57 a 62), o acórdão rejeitou a proposta da unidade instrutora para que o BNDES se abstivesse de pagar PLR e RVA, reconhecendo que o banco já ajustou os limites dessas remunerações de forma alinhada à sua discricionariedade gerencial. Não há referência a devolução de valores já recebidos, apenas a adequações futuras e limites percentuais. A afirmação contém fato essencial divergente dos autos.;"Trata-se de representação oferecida pelo Ministério Público junto ao TCU, de autoria do 
Procurador Marinus Eduardo de Vries Marsico, a fim de que esta Corte avalie a incidência do disposto 
no § 9º do art. 37 da Constituição Federal, que trata do teto remuneratório sobre os empregados 
públicos do Banco Nacional de Desenvolvimento Econômico e Social (BNDES) (peça 1).  
2. Ao longo da instrução processual, foram acrescentados ao debate outros aspectos relativos 
à estrutura salarial do funcionalismo do BNDES, incluindo a indicação de verbas que seriam 
consideradas pecuniariamente excessivas ou possivelmente irregulares. 
3. Após o saneamento dos autos via inspeção e realização de oitiva ao BNDES, autorizada 
pelo então relator Ministro Vital do Rêgo (peça 81), a unidade instrutora apresentou posições 
divergentes, como descrito a seguir. 
4. O auditor responsável pela análise (peça 168) concluiu à época que não seria necessário 
alterar a classificação do BNDES de empresa pública para autarquia ou classificá-la como dependente 
para limitar os salários de seus empregados ao teto constitucional, sendo suficiente para tanto a 
constatação de que o funding utilizado pelo BNDES é majoritariamente de fontes públicas, assim 
como de empréstimos efetuados pelo Tesouro mediante emissão direta de títulos públicos.  
5. O diretor da unidade concordou parcialmente com o auditor, divergindo quanto à 
necessidade de reclassificar o BNDES como estatal dependente. Essa definição seria primordial para 
submeter o banco ao teto remuneratório constitucional e consequentemente proibir a distribuição de 
participação nos lucros e resultados (peça 169). 
6. O auditor-chefe da unidade discordou de ambos (peça 170), por considerar que o acesso a 
funding público é inerente à condição de banco de desenvolvimento, sendo necessariamente 
remunerado por isso. Registra que o valor dispendido para o pagamento das despesas com pessoal viria 
do resultado da intermediação financeira e retira a proposta de firmar o entendimento de que o BNDES 
seja considerado como empresa estatal dependente. Em sequência, complementa os encaminhamentos 
relacionados à não aprovação do plano de cargos e salários pela Secretaria de Coordenação e 
Governança das Empresas Estatais (Sest) e ao pagamento irregular de determinadas gratificações. 
7. Em razão das considerações feitas nessa fase, foi concedido novo prazo para que o banco 
se manifestasse a respeito das consequências práticas da implementação das medidas aventadas e 
eventuais alternativas. 
8. Após novo pronunciamento do BNDES, o auditor retornou à conclusão de que o banco 
estaria sujeito à incidência do teto constitucional previsto no inciso XI. c/c o § 9º do art. 37 da CF, uma 
vez que seu funding seria majoritariamente proveniente dos recursos públicos e daí sairiam os recursos 
para o pagamento de despesas de pessoal ou de custeio em geral (peça 232, p. 18). 
9. Em síntese, a instrução argumenta que a LRF pode ser interpretada de forma a criar uma 
nova classe de estatal submetida ao teto constitucional. Essa categoria incluiria empresas cujo funding 
fosse composto por recursos provenientes da União, independentemente da rubrica, como no caso do 
BNDES. Mesmo que essas estatais obtivessem lucro, ainda assim estariam submetidas ao teto 
remuneratório, pois, de maneira indireta, utilizariam esse ganho para custear suas despesas, tendo 
como origem os recursos recebidos do Tesouro.  
10. Desta feita, a instrução do auditor teve anuência do corpo diretivo da unidade (peças 233 e 
234), sendo a proposta final da unidade instrutora:  
Para verificar as assinaturas, acesse www.tcu.gov.br/autenticidade e informe o código 77445706. [SEP_CONTEXTO] 51. Em que pese não receber rubricas orçamentárias com o selo de ‘despesas com pessoal’ e 
‘despesas de custeio’, o BNDES paga seus empregados e custeia suas despesas a partir do 
recebimento de verbas públicas (Tesouro e FAT). Ao final e ao cabo paga sua folha de pessoal, seu 
PLR, sua RVA e seu custeio com dinheiro provindo do orçamento. 
52. Imaginar coisa diversa dimana do olhar dogmático, que gera ‘o risco de distanciamento 
progressivo da própria realidade social’. Como assevera o professor Tércio Ferraz: conhecimento 
dogmático que não trabalha com certezas, mas com incertezas, justamente aquelas que, na 
sociedade, foram aparentemente eliminadas (ou inicialmente delimitadas) pelos dogmas (item 41 
desta instrução). 
53. O grau de distanciamento da realidade em se imaginar que o BNDES não pague seus 
empregados e dirigentes e seu custeio com recursos públicos, pode ser exemplificado por meio da 
seguinte ilustração: imagine-se que a Petrobras desfrute do mesmo privilégio que o BNDES. Ou 
seja, que a União, como por encanto, passasse a fornecer sem custo à Petrobras a sua matéria-
prima: petróleo e gás natural (equivalente à matéria-prima do BNDES: os recursos do Tesouro e do 
FAT). 
54. Que, por esse fornecimento, a União só cobrasse que a Petrobras mantivesse o abastecimento 
de derivados (combustíveis, óleos lubrificantes e parafinas) para o mercado nacional. 
55. Sem os custos inerentes de prospecção, perfuração e extração, a Petrobras se tornaria a mais 
rentável empresa de petróleo do mundo. Resta claro que não seria mérito dela, mas do milagre da 
obtenção de matéria-prima a custo zero. Poderia inclusive poder pagar PLR e RVA a seus 
empregados e dirigentes nos níveis atualmente pagos pelo BNDES. 
56. O BNDES desfruta exatamente desse privilégio (que, no exemplo da Petrobras, totalmente no 
mundo da ficção). Recebe matéria-prima a custo zero (ou próximo de zero), faz operações de 
empréstimos e obtém a sua receita5. Deixa-se de tratar aqui esses dados financeiros, para não 
incorrer em duplicidade, haja vista que estão demonstrados de forma inequívoca nos itens 
expressos no rodapé desta página, presentes no pronunciamento do diretor (peça 169). 
57. Mantendo em seu caixa a quase totalidade dos recursos do FAT “Apesar de terem prazo de 
exigibilidade indefinido, vale registrar que os recursos alocados no FAT Constitucional podem ser 
solicitados pelo FAT no caso de insuficiência de recursos para o pagamento de suas obrigações 
(seguro-desemprego e abono salarial). Segundo as condições estabelecidas pelo Codefat, o BNDES 
teria de realizar a devolução da seguinte forma: até 20% do saldo devedor ao fim do exercício 
anterior nos dois primeiros exercícios, até 10% do terceiro ao quinto exercício e até 5% a partir do 
sexto” – Nota de rodapé infra, peça 169, p. 5). 
58. De posse dessas evidências, é mister se concluir que o BNDES recebe recursos da União para 
pagamento de despesas de pessoal ou de custeio em geral. Todo o seu funding (ou 
majoritariamente) é proveniente dos recursos públicos e daí saem os recursos para o pagamento de 
tais despesas. 
CONCLUSÃO 
59. O representante, Procurador Marinus Eduardo De Vries Marsico (MP-TCU), provocou esta 
Corte de Contas avaliar a incidência do disposto nas normas constitucionais insculpidas no inciso 
XI e no parágrafo 9° do art. 37 do texto constitucional, que trata do teto remuneratório, sobre os 
empregados públicos do Banco Nacional do Desenvolvimento Econômico e Social S.A.– BNDES, 
à luz das fontes de receita pública (peça 1). 
60. Os pronunciamentos de peça 169 (diretor – itens 6 e 7) e 170 (auditor chefe – itens 10 a 12 
desta instrução) enfrentaram essa questão à luz dos conceitos emanados pelos diplomas legal e 
regulamentar (Lei Complementar 101/2000 e Decreto 10.690, de 29 de abril de 2021). [SEP_CONTEXTO] d.3) da existência de verbas remuneratórias, bem como todas as outras benesses de caráter não 
remuneratório, concedidas pelo BNDES ao arrepio ou em condições muito mais favoráveis às 
definidas na Convenção Coletiva de Trabalho da categoria dos bancários, por intermédio de 
Acordos Coletivos de Trabalho não submetidos previamente à SEST e não aprovados previamente 
em sede ministerial, nos termos do art. 1º, inciso IV, do Decreto 3.735/2001; 
d.4) da sua competência em sede de Acordos Coletivos de Trabalho firmados pelo BNDES, nos 
termos do disposto no número ‘4’ da alínea ‘g’ do inciso VI do art. 36, do Decreto 11.437, de 17 de 
março de 2023, submetendo seu posicionamento, após essa análise, via Ministério supervisor, à 
aprovação prévia do Ministro de Estado de Planejamento, Desenvolvimento e Gestão, ou do seu 
sucessor, nos termos do art. 1º, inciso IV, do Decreto 3.735/2001, devendo, ainda, assegurar que a 
execução efetiva das cláusulas do aludido acordo apenas ocorra após a finalização de todo esse 
trâmite de análise e aprovação pelas autoridades competentes; 
f) Dar ciência ao Conselho de Administração do BNDES, com fundamento no disposto no inciso 
II do art. 2º c/c o disposto nos art. 9º e 10 da Resolução TCU 315/2020, e em função de suas 
responsabilidades com a condução das ações relativas à política de gestão de pessoas, prevista na 
norma insculpida no inciso XXIII do art. 16, do Estatuto Social do BNDES, acerca: 
Da existência, nos quadros do BNDES, de assessores externos, admitidos para cargos de livre 
provimento, recebendo salários incompatíveis com os recebidos por empregados concursados do 
banco, que exercem as mesmas funções; e, da necessidade de aprimoramento dos normativos do 
BNDES para que se evite tal situação; 
g) Dar ciência ao representante do Acórdão e do teor do Voto e Relatório, que o fundamente; 
h) Arquivar o presente processo, com fundamento no disposto no inciso III do art. 169, do 
Regimento Interno do Tribunal de Contas da União.” 
 É o relatório. [SEP_CONTEXTO] quaisquer operações financeiras em que sejam utilizados recursos do funding do banco, 
explicitando os impactos financeiros presentes e futuros aos cofres públicos da União, com base no 
Pronunciamento Técnico CPC 05 (R1) – Divulgação sobre Partes Relacionadas, conforme 
preconiza o Plano Contábil das Instituições do Sistema Financeiro Nacional (Cosif), de observância 
obrigatória pelo banco, segundo a Resolução CMN 4.858/2020 e a Resolução BCB 92/2021, em 
que se exige que as transações com partes relacionadas sejam devidamente registradas nas 
demonstrações contábeis de instituições financeiras, como é o caso do relacionamento existente 
entre BNDES e União Federal; e 
b.11) encaminhe ao Tribunal, no prazo de 45 dias, as medidas adotadas para o cumprimento das 
determinações proferidas nos subitens b.1 a b.10 acima; 
c) determinar à Secretaria de Coordenação e Governança das Empresas Estatais – SEST, com 
fundamento no art. 250, inciso II, do Regimento Interno do Tribunal de Contas da União, que: 
c.1) adote, em prazo compatível com os respectivos itens, as medidas necessárias para que o Banco 
Nacional de Desenvolvimento Econômico e Social dê cumprimento às medidas preconizadas nos 
itens b.1 a b.10 desta proposta de encaminhamento; 
c.2) manifeste-se, no prazo de trinta dias, sobre o plano de cargos e salários do Banco Nacional de 
Desenvolvimento Econômico e Social, o PECS, conforme preconizado no art. 98, inciso VI, alínea 
‘g’, item 4, do Decreto 9.745/2019, de modo que se possa aferir se aquele plano atende aos 
dispositivos que regem a política de remuneração do Poder Executivo com relação às empresas 
estatais, adotando as providências pertinentes para as adequações que se façam necessárias, 
inclusive aquelas necessárias à correção das irregularidades apuradas nestes autos, e submetendo o 
aludido plano à aprovação do Ministro de Estado do Planejamento, Desenvolvimento e Gestão, ou 
do seu sucessor, nos termos do art. 1º, inciso III, do Decreto 3.735/2001; 
c.3) adote as medidas necessárias para adequar, em trinta dias, todas as verbas remuneratórias, bem 
como todas as outras benesses de caráter não remuneratório, concedidas pelo Banco Nacional de 
Desenvolvimento Econômico e Social ao arrepio ou em condições muito mais favoráveis às 
definidas na Convenção Coletiva de Trabalho da categoria dos bancários, por intermédio de 
Acordos Coletivos de Trabalho não submetidos previamente ao DEST/SEST e não aprovados 
previamente em sede ministerial, nos termos do art. 1º, inciso IV, do Decreto 3.735/2001, firmados 
pelo banco no passado com abuso de direito, os quais seriam, portanto, ilícitos, nos termos do art. 
187 do Código Civil, ressalvando-se os vencimentos básicos dos empregados, que seriam 
irredutíveis, nos termos do art. 7º, inciso VI, da Constituição da República; 
c.4) proceda, doravante, à manifestação prévia de todos os Acordos Coletivos de Trabalho firmados 
pelo Banco Nacional de Desenvolvimento Econômico e Social, nos termos do art. 98, inciso VI, 
alínea ‘g’, item 2, do Decreto 9.745/2019, submetendo seu posicionamento, após essa análise, via 
Ministério supervisor, à aprovação prévia do Ministro de Estado de Planejamento, 
Desenvolvimento e Gestão, ou do seu sucessor, nos termos do art. 1º, inciso IV, do Decreto 
3.735/2001, devendo, ainda, assegurar que a execução efetiva das cláusulas do aludido acordo 
apenas ocorra após a finalização de todo esse trâmite de análise e aprovação pela autoridade 
competente; 
c.5) encaminhe ao Tribunal, no prazo de 45 dias, as medidas adotadas para o cumprimento das 
determinações proferidas nos subitens c.1 a c.4 acima; 
d) recomendar, nos termos do art. 250, inciso III, do Regimento Interno do Tribunal de Contas da 
União, ao Conselho de Administração do Banco Nacional de Desenvolvimento Econômico e 
Social, com fundamento no art. 11 da Resolução–TCU 315/2020, que promova as discussões 
necessárias para aprimorar os normativos do BNDES de modo que não haja a possibilidade de 
ocorrer a nomeação de pessoas para cargos de livre provimento com o recebimento de salários 
incompatíveis com os recebidos por empregados do banco que exercem as mesmas funções, tendo 
em vista sua responsabilidade pela condução das ações relativas à política de gestão de pessoas, 
conforme disposto no art. 36, inciso X, do Estatuto Social do banco; 
Para verificar as assinaturas, acesse www.tcu.gov.br/autenticidade e informe o código 77445700. [SEP_CONTEXTO] 52. Importante consignar que durante o curso processual, o BNDES demonstrou que adotou 
medidas para corrigir impropriedades em determinadas práticas remuneratórias apontadas ainda na 
etapa de instrução processual.  
53. Como empresa estatal federal, ressalto que se aplicam ao banco, no que diz respeito a 
obrigações civis e trabalhistas, o regime jurídico das empresas privadas, nos termos do art. 173, § 1º, 
inciso II, da Constituição Federal.  
54. De forma que, dentro de sua autonomia gerencial e poder discricionário, o BNDES pode 
desenvolver suas políticas de pessoal e fazer acordos trabalhistas, inclusive em âmbito judicial, com a 
avaliação dos seus impactos econômicos, financeiros e operacionais.  
55. Além disso, é importante registrar que, entre o pronunciamento da unidade instrutora e o 
presente julgamento, o BNDES iniciou a elaboração do Novo Plano de Cargos e Salários (NPCS), 
após avaliação para mitigação de riscos judiciais e administrativos, que passará a vigorar para todas as 
novas contratações decorrentes do concurso público realizado em 2024.  
56. Com a elaboração do NPCS, os planos anteriores – Plano Estratégico de Cargos e Salários 
(PECS) e Plano Uniforme de Cargos e Salários (PUCS) – ficarão fechados para novos contratos de 
trabalho, de modo que os cargos ocupados serão extintos à medida que vagarem.   
Participação nos Lucros e Resultados (PLR) e Remuneração Variável Anual (RVA) 
57. Em consequência do entendimento já registrado neste voto quanto à não classificação de 
dependência da empresa estatal, não se sustenta a proposta de determinação da unidade instrutora para 
que o BNDES se abstenha de pagar valores referentes à Participação nos Lucros ou Resultados (PLR) 
a seus empregados e de Remuneração Variável Anual (RVA) a seus dirigentes. 
58. Dessa maneira, discordo da proposta da unidade instrutora para determinar ao BNDES que 
se abstenha de pagá-las. 
59. Resta pendente de análise a proposta de encaminhamento feita pela unidade (peça 170, p. 
6) para que o BNDES: 
“(...) considere, doravante, para fins de cômputo do lucro da estatal a ser objeto de distribuição aos 
empregados e administradores via Participação nos Lucros ou Resultados (PLR) ou Remuneração 
Variável Anual (RVA), respectivamente, tão-somente metas e retornos financeiros vinculados 
estritamente aos objetivos institucionais do banco estatal, não devendo ser computados 
quaisquer ganhos que não visem direta e especificamente às finalidades públicas para as 
quais o banco de fomento foi criado, sob pena de gerar um incentivo pernicioso de perseguir 
investimentos mais lucrativos em operações de tesouraria, o que poderia prejudicar a alocação de 
recursos do banco em investimentos de menor rentabilidade, mas aderentes ao interesse público, 
nos termos do art. 3º do Estatuto Social do BNDES;” (grifei) 
60. Em resposta (peça 215, p. 6), o banco informou que já atende à referida proposta, uma vez 
que, desde o Acordo PLR 2017 e o Acordo de RVA de 2020, as metas de PLR e de RVA não incluem 
lucro líquido, que contemplava o resultado de tesouraria.  
61. Informou, ainda, que, desde o exercício de 2019, o valor total de PLR a ser distribuído aos 
empregados está limitado ao percentual de 4,08% do Lucro Líquido Ajustado (que corresponde ao 
lucro líquido do exercício deduzido do resultado auferido com a eventual diferença entre as taxas de 
juros de captação e de aplicação junto à União, descontados dos efeitos tributários de PIS/COFINS, IR 
e CSSL). No Acordo PLR 2024, esse limite foi reduzido para 3,10% (peça 254, p. 6). 
62. A unidade instrutora questionou o fundamento desse limite e sua aplicabilidade ao RVA. 
Observo que esses limites estão dentro da discricionariedade do banco, devendo estar alinhados ao 
plano de negócios e às cartas anuais previstas na Lei das Estatais (13.303/2016). No caso específico do 
RVA, o programa para 2024 determina que o valor total a ser distribuído não poderá ultrapassar a 
Para verificar as assinaturas, acesse www.tcu.gov.br/autenticidade e informe o código 77445706."
