ID_Claim_Resumo;Processo_ID;Sentenca_Claim;Prediction_LLM;Confianca_LLM;Justificativa_LLM;Contexto_Utilizado_LLM
5;733-2025;Segundo o TCU, embora o banco utilize recursos públicos, como os do FAT e FMM, isso não o caracteriza como dependente da União, pois parte dos recursos provém de arrecadação própria.;Correto;1.0000;Os parágrafos indicam que o TCU reconhece que o BNDES utiliza recursos públicos (como FAT e Tesouro), mas argumenta que não é considerado dependente da União porque parte de seus recursos provém de sua própria arrecadação (ex.: lucros de operações financeiras). Isso está alinhado com a conclusão do item 214 do Parágrafo 4, que afirma que o BNDES não recebe recursos da União diretamente para despesas de pessoal ou custeio, justificando a não aplicação do teto remuneratório. A AFIRMAÇÃO reflete essa conclusão.;"51. Em que pese não receber rubricas orçamentárias com o selo de ‘despesas com pessoal’ e 
‘despesas de custeio’, o BNDES paga seus empregados e custeia suas despesas a partir do 
recebimento de verbas públicas (Tesouro e FAT). Ao final e ao cabo paga sua folha de pessoal, seu 
PLR, sua RVA e seu custeio com dinheiro provindo do orçamento. 
52. Imaginar coisa diversa dimana do olhar dogmático, que gera ‘o risco de distanciamento 
progressivo da própria realidade social’. Como assevera o professor Tércio Ferraz: conhecimento 
dogmático que não trabalha com certezas, mas com incertezas, justamente aquelas que, na 
sociedade, foram aparentemente eliminadas (ou inicialmente delimitadas) pelos dogmas (item 41 
desta instrução). 
53. O grau de distanciamento da realidade em se imaginar que o BNDES não pague seus 
empregados e dirigentes e seu custeio com recursos públicos, pode ser exemplificado por meio da 
seguinte ilustração: imagine-se que a Petrobras desfrute do mesmo privilégio que o BNDES. Ou 
seja, que a União, como por encanto, passasse a fornecer sem custo à Petrobras a sua matéria-
prima: petróleo e gás natural (equivalente à matéria-prima do BNDES: os recursos do Tesouro e do 
FAT). 
54. Que, por esse fornecimento, a União só cobrasse que a Petrobras mantivesse o abastecimento 
de derivados (combustíveis, óleos lubrificantes e parafinas) para o mercado nacional. 
55. Sem os custos inerentes de prospecção, perfuração e extração, a Petrobras se tornaria a mais 
rentável empresa de petróleo do mundo. Resta claro que não seria mérito dela, mas do milagre da 
obtenção de matéria-prima a custo zero. Poderia inclusive poder pagar PLR e RVA a seus 
empregados e dirigentes nos níveis atualmente pagos pelo BNDES. 
56. O BNDES desfruta exatamente desse privilégio (que, no exemplo da Petrobras, totalmente no 
mundo da ficção). Recebe matéria-prima a custo zero (ou próximo de zero), faz operações de 
empréstimos e obtém a sua receita5. Deixa-se de tratar aqui esses dados financeiros, para não 
incorrer em duplicidade, haja vista que estão demonstrados de forma inequívoca nos itens 
expressos no rodapé desta página, presentes no pronunciamento do diretor (peça 169). 
57. Mantendo em seu caixa a quase totalidade dos recursos do FAT “Apesar de terem prazo de 
exigibilidade indefinido, vale registrar que os recursos alocados no FAT Constitucional podem ser 
solicitados pelo FAT no caso de insuficiência de recursos para o pagamento de suas obrigações 
(seguro-desemprego e abono salarial). Segundo as condições estabelecidas pelo Codefat, o BNDES 
teria de realizar a devolução da seguinte forma: até 20% do saldo devedor ao fim do exercício 
anterior nos dois primeiros exercícios, até 10% do terceiro ao quinto exercício e até 5% a partir do 
sexto” – Nota de rodapé infra, peça 169, p. 5). 
58. De posse dessas evidências, é mister se concluir que o BNDES recebe recursos da União para 
pagamento de despesas de pessoal ou de custeio em geral. Todo o seu funding (ou 
majoritariamente) é proveniente dos recursos públicos e daí saem os recursos para o pagamento de 
tais despesas. 
CONCLUSÃO 
59. O representante, Procurador Marinus Eduardo De Vries Marsico (MP-TCU), provocou esta 
Corte de Contas avaliar a incidência do disposto nas normas constitucionais insculpidas no inciso 
XI e no parágrafo 9° do art. 37 do texto constitucional, que trata do teto remuneratório, sobre os 
empregados públicos do Banco Nacional do Desenvolvimento Econômico e Social S.A.– BNDES, 
à luz das fontes de receita pública (peça 1). 
60. Os pronunciamentos de peça 169 (diretor – itens 6 e 7) e 170 (auditor chefe – itens 10 a 12 
desta instrução) enfrentaram essa questão à luz dos conceitos emanados pelos diplomas legal e 
regulamentar (Lei Complementar 101/2000 e Decreto 10.690, de 29 de abril de 2021). [SEP_CONTEXTO] Trata-se de representação oferecida pelo Ministério Público junto ao TCU, de autoria do 
Procurador Marinus Eduardo de Vries Marsico, a fim de que esta Corte avalie a incidência do disposto 
no § 9º do art. 37 da Constituição Federal, que trata do teto remuneratório sobre os empregados 
públicos do Banco Nacional de Desenvolvimento Econômico e Social (BNDES) (peça 1).  
2. Ao longo da instrução processual, foram acrescentados ao debate outros aspectos relativos 
à estrutura salarial do funcionalismo do BNDES, incluindo a indicação de verbas que seriam 
consideradas pecuniariamente excessivas ou possivelmente irregulares. 
3. Após o saneamento dos autos via inspeção e realização de oitiva ao BNDES, autorizada 
pelo então relator Ministro Vital do Rêgo (peça 81), a unidade instrutora apresentou posições 
divergentes, como descrito a seguir. 
4. O auditor responsável pela análise (peça 168) concluiu à época que não seria necessário 
alterar a classificação do BNDES de empresa pública para autarquia ou classificá-la como dependente 
para limitar os salários de seus empregados ao teto constitucional, sendo suficiente para tanto a 
constatação de que o funding utilizado pelo BNDES é majoritariamente de fontes públicas, assim 
como de empréstimos efetuados pelo Tesouro mediante emissão direta de títulos públicos.  
5. O diretor da unidade concordou parcialmente com o auditor, divergindo quanto à 
necessidade de reclassificar o BNDES como estatal dependente. Essa definição seria primordial para 
submeter o banco ao teto remuneratório constitucional e consequentemente proibir a distribuição de 
participação nos lucros e resultados (peça 169). 
6. O auditor-chefe da unidade discordou de ambos (peça 170), por considerar que o acesso a 
funding público é inerente à condição de banco de desenvolvimento, sendo necessariamente 
remunerado por isso. Registra que o valor dispendido para o pagamento das despesas com pessoal viria 
do resultado da intermediação financeira e retira a proposta de firmar o entendimento de que o BNDES 
seja considerado como empresa estatal dependente. Em sequência, complementa os encaminhamentos 
relacionados à não aprovação do plano de cargos e salários pela Secretaria de Coordenação e 
Governança das Empresas Estatais (Sest) e ao pagamento irregular de determinadas gratificações. 
7. Em razão das considerações feitas nessa fase, foi concedido novo prazo para que o banco 
se manifestasse a respeito das consequências práticas da implementação das medidas aventadas e 
eventuais alternativas. 
8. Após novo pronunciamento do BNDES, o auditor retornou à conclusão de que o banco 
estaria sujeito à incidência do teto constitucional previsto no inciso XI. c/c o § 9º do art. 37 da CF, uma 
vez que seu funding seria majoritariamente proveniente dos recursos públicos e daí sairiam os recursos 
para o pagamento de despesas de pessoal ou de custeio em geral (peça 232, p. 18). 
9. Em síntese, a instrução argumenta que a LRF pode ser interpretada de forma a criar uma 
nova classe de estatal submetida ao teto constitucional. Essa categoria incluiria empresas cujo funding 
fosse composto por recursos provenientes da União, independentemente da rubrica, como no caso do 
BNDES. Mesmo que essas estatais obtivessem lucro, ainda assim estariam submetidas ao teto 
remuneratório, pois, de maneira indireta, utilizariam esse ganho para custear suas despesas, tendo 
como origem os recursos recebidos do Tesouro.  
10. Desta feita, a instrução do auditor teve anuência do corpo diretivo da unidade (peças 233 e 
234), sendo a proposta final da unidade instrutora:  
Para verificar as assinaturas, acesse www.tcu.gov.br/autenticidade e informe o código 77445706. [SEP_CONTEXTO] quaisquer operações financeiras em que sejam utilizados recursos do funding do banco, 
explicitando os impactos financeiros presentes e futuros aos cofres públicos da União, com base no 
Pronunciamento Técnico CPC 05 (R1) – Divulgação sobre Partes Relacionadas, conforme 
preconiza o Plano Contábil das Instituições do Sistema Financeiro Nacional (Cosif), de observância 
obrigatória pelo banco, segundo a Resolução CMN 4.858/2020 e a Resolução BCB 92/2021, em 
que se exige que as transações com partes relacionadas sejam devidamente registradas nas 
demonstrações contábeis de instituições financeiras, como é o caso do relacionamento existente 
entre BNDES e União Federal; e 
b.11) encaminhe ao Tribunal, no prazo de 45 dias, as medidas adotadas para o cumprimento das 
determinações proferidas nos subitens b.1 a b.10 acima; 
c) determinar à Secretaria de Coordenação e Governança das Empresas Estatais – SEST, com 
fundamento no art. 250, inciso II, do Regimento Interno do Tribunal de Contas da União, que: 
c.1) adote, em prazo compatível com os respectivos itens, as medidas necessárias para que o Banco 
Nacional de Desenvolvimento Econômico e Social dê cumprimento às medidas preconizadas nos 
itens b.1 a b.10 desta proposta de encaminhamento; 
c.2) manifeste-se, no prazo de trinta dias, sobre o plano de cargos e salários do Banco Nacional de 
Desenvolvimento Econômico e Social, o PECS, conforme preconizado no art. 98, inciso VI, alínea 
‘g’, item 4, do Decreto 9.745/2019, de modo que se possa aferir se aquele plano atende aos 
dispositivos que regem a política de remuneração do Poder Executivo com relação às empresas 
estatais, adotando as providências pertinentes para as adequações que se façam necessárias, 
inclusive aquelas necessárias à correção das irregularidades apuradas nestes autos, e submetendo o 
aludido plano à aprovação do Ministro de Estado do Planejamento, Desenvolvimento e Gestão, ou 
do seu sucessor, nos termos do art. 1º, inciso III, do Decreto 3.735/2001; 
c.3) adote as medidas necessárias para adequar, em trinta dias, todas as verbas remuneratórias, bem 
como todas as outras benesses de caráter não remuneratório, concedidas pelo Banco Nacional de 
Desenvolvimento Econômico e Social ao arrepio ou em condições muito mais favoráveis às 
definidas na Convenção Coletiva de Trabalho da categoria dos bancários, por intermédio de 
Acordos Coletivos de Trabalho não submetidos previamente ao DEST/SEST e não aprovados 
previamente em sede ministerial, nos termos do art. 1º, inciso IV, do Decreto 3.735/2001, firmados 
pelo banco no passado com abuso de direito, os quais seriam, portanto, ilícitos, nos termos do art. 
187 do Código Civil, ressalvando-se os vencimentos básicos dos empregados, que seriam 
irredutíveis, nos termos do art. 7º, inciso VI, da Constituição da República; 
c.4) proceda, doravante, à manifestação prévia de todos os Acordos Coletivos de Trabalho firmados 
pelo Banco Nacional de Desenvolvimento Econômico e Social, nos termos do art. 98, inciso VI, 
alínea ‘g’, item 2, do Decreto 9.745/2019, submetendo seu posicionamento, após essa análise, via 
Ministério supervisor, à aprovação prévia do Ministro de Estado de Planejamento, 
Desenvolvimento e Gestão, ou do seu sucessor, nos termos do art. 1º, inciso IV, do Decreto 
3.735/2001, devendo, ainda, assegurar que a execução efetiva das cláusulas do aludido acordo 
apenas ocorra após a finalização de todo esse trâmite de análise e aprovação pela autoridade 
competente; 
c.5) encaminhe ao Tribunal, no prazo de 45 dias, as medidas adotadas para o cumprimento das 
determinações proferidas nos subitens c.1 a c.4 acima; 
d) recomendar, nos termos do art. 250, inciso III, do Regimento Interno do Tribunal de Contas da 
União, ao Conselho de Administração do Banco Nacional de Desenvolvimento Econômico e 
Social, com fundamento no art. 11 da Resolução–TCU 315/2020, que promova as discussões 
necessárias para aprimorar os normativos do BNDES de modo que não haja a possibilidade de 
ocorrer a nomeação de pessoas para cargos de livre provimento com o recebimento de salários 
incompatíveis com os recebidos por empregados do banco que exercem as mesmas funções, tendo 
em vista sua responsabilidade pela condução das ações relativas à política de gestão de pessoas, 
conforme disposto no art. 36, inciso X, do Estatuto Social do banco; 
Para verificar as assinaturas, acesse www.tcu.gov.br/autenticidade e informe o código 77445700. [SEP_CONTEXTO] “(...) 206. A análise empreendida nos parágrafos anteriores demonstra que o BNDES possui uma 
posição privilegiada com relação às demais instituições financeiras. 
207. O seu funding é majoritariamente constituído por recursos de natureza pública, que foram 
internalizados no passivo do banco a um custo de captação muito abaixo do mercado e sem a 
necessidade de empreender esforços para a construção desse passivo, já que normativos legais e 
decisões governamentais respaldaram essa situação. 
208. Por outro lado, a constituição do ativo do banco foi favorecida pela prática de empréstimos a 
juros subsidiados que não encontravam paralelo em qualquer instituição financeira privada, 
podendo-se dizer que também não foi preciso muito esforço para a constituição do ativo do banco, 
pois a demanda por esses recursos sempre foi elevada. 
209. A análise de risco do banco aponta que a maior parte dos recursos aplicados no seu ‘negócio’, 
que é a intermediação financeira de recursos, não está exposta a risco, pois parcela significativa 
desses recursos está aplicada em operações indiretas, e para as operações diretas existem 
mitigadores de risco. As sobras de capital não aplicado nos segmentos de renda fixa e renda 
variável são aplicadas majoritariamente pela Tesouraria do banco em títulos públicos que possuem 
risco muito reduzido e retorno substancial em função da diferença entre a taxa de captação e a taxa 
de retorno dos títulos públicos. 
210. Essa posição privilegiada com relação ao recebimento de recursos a custo mais baixo que o 
mercado e a possibilidade de emprestar recursos com juros subsidiados, o que faz com que as 
linhas de crédito oferecidas fiquem mais atraentes do que as de outras instituições financeiras, 
aliadas às diferenças de taxas entre a captação e aplicação das sobras de caixas em títulos públicos, 
propiciou ao BNDES aumentar seu lucro de R$ 7 bilhões em 2008 para R$ 16 bilhões só no 
primeiro trimestre de 2019 e ter seu Patrimônio Líquido aumentado em R$ 64 bilhões ou 216%. 
211. Adicionalmente, sua carteira de renda variável recebeu aporte expressivo de títulos do 
Governo Federal, sendo majoritariamente constituída por ações de grandes empresas, estando ainda 
essa parte da carteira protegida por Resolução do Conselho Monetário Nacional quanto a possíveis 
perdas de valor que poderiam impactar o resultado do banco. 
212. O conjunto dessas observações aponta para uma influência decisiva do Governo Federal para 
o atingimento do resultado do banco. Não resta dúvida que a concessão de recursos com taxas 
reduzidas e prazos diferenciados, as decisões de políticas de fomento por meio da concessão de 
empréstimos a juros subsidiados, o que faz com que o número de operações do banco cresça de 
forma muito acima do esperado em situações normais de mercado, a alteração de normas do 
sistema financeiro nacional excluindo o BNDES de sua sujeição, contribuem para que o BNDES 
atinja resultados expressivos. Pode-se afirmar que o banco não teria tais resultados se não gozasse 
dessa situação privilegiada. 
213. Conforme demonstrado nesse trabalho o BNDES sempre contou com elevado montante de 
recursos públicos na constituição do seu funding. A questão da sujeição ou não dos empregados do 
BNDES ao disposto no art. 37, § 9º, da Constituição Federal, que trata do teto remuneratório, não 
tinha sido trazida à tona antes, pois perdurava um certo equilíbrio entre aquela remuneração e o teto 
constitucional. Com o descolamento da remuneração dos empregados do BNDES do teto 
constitucional e também os elevados aportes de recursos do Governo Federal para custeio dos 
programas de incentivo ao desenvolvimento com taxas equalizáveis, que proporcionou ao BNDES 
resultados expressivos, a sociedade passou a questionar o nível salarial dos empregados do 
BNDES. 
214. Atendo-se ao normativo constitucional que regula o limite de remuneração da administração 
pública, sem procurar soluções estranhas a ele, os empregados do BNDES não estariam sujeitos ao 
teto constitucional. O preceito jurídico esculpido na lei não apresenta lacuna quando determina no 
parágrafo 9º que o disposto no inciso XI do art. 37 aplica-se às empresas públicas e às sociedades 
de economia mista, e suas subsidiárias, que receberem recursos da União, para pagamento de 
despesas de pessoal ou de custeio em geral. O BNDES não recebe recursos da União diretamente 
para esses fins. 
Para verificar as assinaturas, acesse www.tcu.gov.br/autenticidade e informe o código 77445700. [SEP_CONTEXTO] O BNDES, com essa afirmação faz parecer que os valores são idênticos aos recebidos pelos demais 
trabalhadores bancários, entretanto cotejando o valor de Vale Refeição (ou Auxílio Refeição) 
disposto na CCT 2022-2024 dos bancários (Cláusula 14 – peça 226, p. 13): R$ 46,11 por dia de 
trabalho (equivalendo a R$ 1.014,42 por mês, considerando 22 dias de trabalho no período), com o 
valor de Vale Refeição previsto no ACT 2022-2024 dos empregados do sistema BNDES (Cláusula 
4ª – peça 211, p. 3): R$ 1.857,61. Ou seja, os bancários do setor privado têm direito a apenas 
54,6% do valor empregados da empresa pública. 
Destarte, deve ser mantida a proposta de determinação de que o BNDES, com fulcro nos 
princípios constitucionais da moralidade e da eficiência, deixe de reajustar (e/ou aumentar) os 
valores do Vale Refeição até que sejam compatíveis com aqueles estabelecidos pela Convenção 
Coletiva de Trabalho da categoria dos bancários. 
O argumento utilizado pela segunda vez pelo BNDES de que no momento em que há uma 
turbulência entre a direção do banco e seus empregados, para superar o impasse existente, a direção 
do BNDES cede às reivindicações desses, independentemente de estar violando lei, estatuto, 
regulamento oriundo do controlador, é um procedimento que não seria utilizado por uma empresa 
que não confunde os interesses empresariais com os interesses pessoais dos seus dirigentes e dos 
empregados. 
Com fulcro nos princípios constitucionais da legalidade, impessoalidade, moralidade, eficiência e 
outros correlatos, impõe-se dar ciência  ao BNDES, nas situações em que haja uma turbulência 
entre os interesses corporativos de seus empregados e a sua direção, em torno de reinvindicações 
não amparadas na lei, no estatuto, em regulamentos expedidos por órgãos da União e decisões do 
TCU, da possibilidade  de não ceder a esses interesses sindicais e instaurar o devido processo de 
dissídio coletivo junto à Justiça Trabalhista. 
vi)  Limitação das horas extras: ‘a proposta de encaminhamento merece reanálise e 
reconsideração, uma vez que desde o ACT de 2009 não há mais a previsão de que a hora-extra 
diária contratada seja remunerada com o adicional de 100% (cem por cento) sobre a hora normal. A 
prática do BNDES é efetuar tais pagamentos seguindo a Consolidação das Leis do Trabalho (CLT) 
e a Lei nº 605/1949’ (peça 215, p. 7-8); 
Análise: O BNDES afirma que desde o ACT de 2009 não há mais a previsão de que a hora-extra 
diária contratada pelo BNDES seja remunerada com o adicional de 100% (cem por cento) sobre a 
hora normal, que a sistemática de pagamento das horas extras no BNDES é uma medida 
excepcionalíssima, pois é restrita aos casos eventuais de imperiosa necessidade de serviço, a 
critério do gestor, além de ser vedada para o empregado em exercício de Função de Confiança. 
Considerando que o BNDES já se adequa aos ditames proposta no Relatório de Fiscalização e 
instrução de peça 77, convalidada nos pronunciamentos do diretor (peça 169) e do auditor chefe 
(peça 170), impõe-se a revisão e retirada do rol de determinações ao BNDES essa matéria 
atinente às horas extraordinárias. 
vii) Adequação do Programa de Assistência Educacional: ‘a proposta de encaminhamento 
merece reanálise e reconsideração, uma vez que o benefício em questão foi aprovado pela Sest, 
conforme Nota Técnica SEI nº 55795/2022/ME, que analisou o ACT 2022-2024. A atual política 
de reajuste da remuneração do BNDES e de seus benefícios é a de seguir estritamente os índices 
acordados na convenção nacional dos bancários da FENABAN’ (peça 215, p. 8); 
Análise: O BNDES, além de reconhecer que o programa, no exercício de 2009, não teve o seu 
índice de reajuste sido negociado com o então Dest, apenas registrou que o benefício em questão 
foi aprovado pela Sest, conforme Nota Técnica SEI nº 55795/2022/ME, que analisou o ACT 2022-
2024 (peça 215, 48-49). 
O Programa de Assistência Educacional do BNDES, nos termos do disposto no art. 3º da Instrução 
de Serviço AARH/SUP 001/2017 (apud Instrução deste processo, peça 168, p. 97-98), contempla 
como beneficiários empregados que tenham dependentes entre o nascimento até completarem a 
maioridade (ou dezessete anos e onze meses), nas seguintes modalidades: a) Auxílio-Babá; b) 
Auxílio-Creche; e, c) Auxílio Ensino Fundamental e Ensino Médio. 
Para verificar as assinaturas, acesse www.tcu.gov.br/autenticidade e informe o código 77445700."
